{
  "soczewka": "L4",
  "runda": "B",
  "commit_head": "5d3dcf9f0d99dedc1fe201c3e318f46d6f35ba5d",
  "werdykty": [
    {
      "cel": "L4-01",
      "werdykt": "NIE SPRAWDZIŁEM",
      "dowod": "Priorytet DOPISEKu B dla L4 stawia 0.5.0 i 0.9.8 przed 0.2.0; przy budżecie 30 wywołań (już zużytym na L4-02/03/05/06/07/08/09/10/11/13/14/16) nie starczyło na trzeci pełny cykl instalacja-dane-upgrade."
    },
    {
      "cel": "L4-02",
      "werdykt": "SPEŁNIONE",
      "plik": "includes/aktywacja.php",
      "linia": 170,
      "dowod": "Zainstalowano 0.5.0 (schemat 4, 6 tabel, bez `opinie`), wstawiono produkt+zamówienie SQL-em, potem `wp plugin install sklep-agentow-0.9.13.zip --force --activate`: `plugin get --field=version` -> 0.9.13, `option get sklepag_wersja_schematu` -> 5, `SHOW TABLES LIKE 'wp_sklepag%'` pokazuje 7 tabel (w tym nową `opinie`), `SELECT ... FROM wp_sklepag_produkty/zamowienia` zwraca ten sam wiersz (Produkt V050 / kupiec-v050@seed.local / status oplacone) bez zmian, cron `sklepag_dociagnij_zalegle` obecny po upgrade."
    },
    {
      "cel": "L4-03",
      "werdykt": "SPEŁNIONE",
      "plik": "includes/aktywacja.php",
      "linia": 162,
      "dowod": "Zainstalowano 0.9.8 (schemat 5, 7 tabel), wstawiono produkt+zamówienie, upgrade do 0.9.13: wersja 0.9.13, schemat pozostał 5 (dbDelta idempotentne, brak migracji bo już schemat 5), `DESCRIBE wp_sklepag_opinie` i `DESCRIBE wp_sklepag_zamowienia` identyczne przed/po (0 różnic kolumn), dane (Produkt V098 / kupiec-v098@seed.local / oplacone) zachowane bez zmian."
    },
    {
      "cel": "L4-04",
      "werdykt": "BRAK",
      "proba_kontrolna": "`grep -n -i \"DISABLE_WP_CRON|cron systemow|kopia zapas|rollback|cofni\" readme.txt DOKUMENTACJA-TECHNICZNA.md dokumentacja/INSTRUKCJA-INSTALACJI.md` -> 0 trafień. Próba kontrolna (grep -c -i 'stripe|krok' na tych samych plikach -> 20 / 10 / 27 trafień) potwierdza, że narzędzie działa i pliki nie są puste — to prawdziwe zero, nie błąd szukania. Kod (`includes/aktywacja.php`) też nie definiuje żadnej ścieżki rollbacku (dbDelta jest jednokierunkowe, brak funkcji `sklepag_rollback*`/`sklepag_migruj_w_dol*` — grep na tym samym repo zero trafień)."
    },
    {
      "cel": "L4-05",
      "werdykt": "SPEŁNIONE",
      "plik": "uninstall.php",
      "linia": 16,
      "dowod": "Ścieżka A (przełącznik sklepag_usun_dane_przy_odinstalowaniu domyślnie nieustawiony): ustawiono sklepag_stripe_webhook_sekret='whsec_[ZREDAGOWANE]', `wp plugin deactivate && wp plugin uninstall`. PO: `option list --search='*sklepag*'` nie zawiera już sekretu (był, zniknął), 7 tabel wp_sklepag_* nadal istnieje, 24 zamówienia nadal w bazie (`SELECT COUNT(*) FROM wp_sklepag_zamowienia` -> 24), 6 stron nadal istnieje, `cron event list` nie zawiera już `sklepag_dociagnij_zalegle` (był, zniknął)."
    },
    {
      "cel": "L4-06",
      "werdykt": "ROZJAZD",
      "dowod": "Ścieżka B (sklepag_usun_dane_przy_odinstalowaniu=1): PO uninstall `SHOW TABLES LIKE 'wp_sklepag%'` = puste (0 wierszy), `option list --search='*sklepag*'` = puste, 4 strony wtyczki skasowane. Diff NIE jest jednak pusty: (1) `SELECT option_name FROM wp_options WHERE option_name LIKE '%sklepag%'` PO uninstall nadal zwraca `_transient_sklepag_idem_...` i `_transient_timeout_sklepag_idem_...` — patrz znalezisko 'transient sklepag_idem przeżywa pełne czyszczenie'; (2) katalog chroniony z plikiem produktu (`sklepag-chronione-ez6o2qJPYen1I9Sb/produkt-seed`) PRZETRWAŁ na dysku (ls -la po uninstall identyczny jak przed, te same daty modyfikacji) — patrz znalezisko 'katalog chroniony przeżywa pełne czyszczenie'."
    },
    {
      "cel": "L4-07",
      "werdykt": "SPEŁNIONE",
      "plik": "uninstall.php",
      "linia": 22,
      "dowod": "`wp_clear_scheduled_hook('sklepag_dociagnij_zalegle')` wykonuje się PRZED wczesnym `return` (linia 24-26), więc cron znika w OBU ścieżkach: `cron event list` po ścieżce A i po ścieżce B nie zawiera już `sklepag_dociagnij_zalegle` (zostają tylko crony rdzenia WP: wp_version_check itp.)."
    },
    {
      "cel": "L4-08",
      "werdykt": "SPEŁNIONE",
      "plik": "includes/aktywacja.php",
      "linia": 154,
      "dowod": "`plugin deactivate`: `cron event list | grep -c sklepag` -> 0. `plugin activate`: `grep -c sklepag` -> 1 (bez duplikatu). `option get sklepag_katalog_chroniony` niezmieniony przed/po cyklu. `SELECT COUNT(*) FROM wp_sklepag_produkty/zamowienia` niezmienione (1/1 w tym momencie testu) — brak utraty danych, brak duplikatu harmonogramu."
    },
    {
      "cel": "L4-09",
      "werdykt": "SPEŁNIONE",
      "plik": "includes/zakup.php",
      "linia": 535,
      "dowod": "Wstawiono 2 wiersze do wp_sklepag_logowania: czas=NOW-91dni ('stary91'), czas=NOW-89dni ('mlody89'). `wp cron event run sklepag_dociagnij_zalegle` -> 'Executed'. PO: SELECT zwraca WYŁĄCZNIE 'mlody89' — 'stary91' usunięty. Próba kontrolna (wiersz 89-dniowy) potwierdza, że retencja tnie DOKŁADNIE granicę 90 dni, nie kasuje na oślep."
    },
    {
      "cel": "L4-10",
      "werdykt": "SPEŁNIONE INACZEJ",
      "plik": "includes/aktywacja.php",
      "linia": 141,
      "jak_czlowiek_tego_uzywa": "Mapa właścicieli zbudowana grepem po `update_option|add_option|delete_option|set_transient|wp_schedule|wp_insert_post|mkdir|file_put_contents|CREATE TABLE` w całym `includes/`: KAŻDA opcja/tabela/cron ma dokładnie JEDNEGO pisarza-właściciela poza jednym wyjątkiem świadomie zdublowanym z zabezpieczeniem idempotencji: `sklepag_dociagnij_zalegle` jest planowany zarówno w `includes/aktywacja.php:142` (aktywacja) jak i w `sklep-agentow.php:61` (self-heal na `plugins_loaded`, chroniony `wp_next_scheduled()` — nie tworzy duplikatu, potwierdzone w L4-08). `sklepag_reconciliation_ostatnia` zapisywana z dwóch miejsc w `admin-dashboard.php` (linie 196 i 212) — to ten sam moduł (self-heal/dociągnij), nie dwa niezależne pisarze. Sprzątanie: `uninstall.php` kasuje wszystko przez jeden zbiorczy `DELETE ... LIKE 'sklepag_%'` (poza wyjątkiem opisanym w L4-06) + jawne DROP TABLE + wp_clear_scheduled_hook + delete_metadata dla `sklepag_zamowien_na_strone` (per-user meta z WP core Screen Options, jedyny zapis NIE mający jawnego `update_user_meta` w kodzie wtyczki — ustawia go WP core)."
    },
    {
      "cel": "L4-11",
      "werdykt": "ROZJAZD",
      "plik": "includes/opinie.php",
      "linia": 184,
      "dowod": "Wstawiono opinię z zamowienie_id=999999 (nieistniejące). Wywołano bezpośrednio produkcyjną funkcję `sklepag_opinia_moderuj(999999_id, 'przyjmij')` przez `wp eval`. Wynik: funkcja zwróciła `true`, status opinii zmienił się na 'przyjeta' (OPUBLIKOWANA), zamiast odmowy. Patrz znalezisko 'moderacja publikuje opinię bez zamówienia'."
    },
    {
      "cel": "L4-12",
      "werdykt": "BRAK",
      "proba_kontrolna": "Ten sam grep co L4-04 (`DISABLE_WP_CRON|cron systemow`) na readme.txt/DOKUMENTACJA-TECHNICZNA.md/dokumentacja/INSTRUKCJA-INSTALACJI.md = 0 trafień, próba kontrolna (stripe/krok) > 0 w tych samych plikach. Behawioralna część (czy `sklepag_dociagnij_zalegle` faktycznie NIE odpali się bez żadnych odwiedzin przez godziny) NIE DA SIĘ SPRAWDZIĆ w budżecie tej rundy — wymagałoby wyłączenia WP-Cron i pozostawienia stosu bez JAKIEGOKOLWIEK żądania HTTP (w tym mojego własnego `wp-cli`, które NIE wyzwala pseudo-crona jak żądanie HTTP, więc test i tak byłby pośredni). Fakt WordPressa cytowany ze źródła: developer.wordpress.org/plugins/cron/ — „WP-Cron does not run constantly as the system cron does; it is only triggered on page load.”"
    },
    {
      "cel": "L4-13",
      "werdykt": "SPEŁNIONE",
      "plik": "includes/aktywacja.php",
      "linia": 17,
      "dowod": "`SHOW CREATE TABLE wp_sklepag_zamowienia` -> `ENGINE=InnoDB DEFAULT CHARSET=utf8mb4 COLLATE=utf8mb4_unicode_520_ci`, klucz UNIQUE na `stripe_session_id varchar(255)` utworzony bez błędu/ostrzeżenia o przekroczeniu limitu indeksu (MariaDB 11.8.8 ma domyślnie włączony large_prefix/DYNAMIC row format)."
    },
    {
      "cel": "L4-14",
      "werdykt": "SPEŁNIONE",
      "dowod": "`bash narzedzia-qa/stos.sh --stos probny tabele` -> lista 7 tabel wp_sklepag_*. `bash narzedzia-qa/stos.sh --stos probny wiersze wp_sklepag_zamowienia` -> 'wierszy: 1' (zgodnie ze stanem bazy w tamtym momencie testu). Okno na tabele sklepu potwierdzone wykonaniem, nie samą lekturą."
    },
    {
      "cel": "L4-15",
      "werdykt": "NIE SPRAWDZIŁEM",
      "dowod": "Priorytet niższy w DOPISEKu B ('L4-08,09,14,15 → reszta'); budżet 30 wywołań wyczerpany na celach wyższego priorytetu (L4-06/02/03/09/11) zanim doszłam do porównania z pełną LINIĄ-BAZOWĄ."
    },
    {
      "cel": "L4-16",
      "werdykt": "SPEŁNIONE INACZEJ",
      "plik": "includes/aktywacja.php",
      "linia": 131,
      "jak_czlowiek_tego_uzywa": "3 pełne cykle `plugin install --force --activate` na WP 6.7.2 / PHP 8.1.32 (0.5.0, 0.9.8, 0.9.13×2) nie wypisały w wyjściu wp-cli żadnego PHP Warning/Notice/Deprecated związanego z migracją/aktywacją — jedyny komunikat błędu w całej sesji ('Deletion of plugin files failed') dotyczy niezwiązanej z kodem wtyczki awarii uprawnień plików kontenera (patrz anomalie). Nie uruchomiłam jednak jawnie WP_DEBUG_LOG z przechwyceniem debug.log przez cały cykl (budżet) — to częściowy dowód, nie wyczerpujące potwierdzenie 'zero notice'."
    }
  ],
  "znaleziska": [
    {
      "teza": "Transient `sklepag_idem_*` (klucz idempotencji zakupu z includes/zakup.php:91,116) NIGDY nie jest usuwany przez uninstall.php, nawet przy pełnym czyszczeniu danych — DELETE w uninstall.php:70 dopasowuje tylko opcje zaczynające się od `sklepag_`, a WP Transients API owija nazwę prefiksem `_transient_`/`_transient_timeout_` PRZED nią.",
      "waga": "DUŻA",
      "typ": "USTERKA",
      "klasa": "NOWA (wariant SCIAGA #2 — LIKE poprawnie eskejpowany, ale wzorzec dopasowania nie uwzględnia, że Transients API dokleja własny prefiks PRZED nazwą klucza)",
      "dowody": [